<?xml version="1.0" encoding="utf-8" ?>
<Project xmlns:xsi="http://www.w3.org/2001/XMLSchema-instance" xsi:noNamespaceSchemaLocation="XSD\project_explorer.xsd">
  <Name>Riverscapes Context</Name>
  <ProjectType>RSContext</ProjectType>
  <Node xpathlabel="Name" xpath="Realizations/RSContext">
    <Children collapsed="false">
      <Node label="Transportation">
        <Children>
          <Node xpathlabel="Name" xpath="Realizations/RSContext/Vector[@id='Roads']" type="vector" symbology="" />
          <Node xpathlabel="Name" xpath="Realizations/RSContext/Vector[@id='Rail']" type="vector" symbology="railroads" />
          <Node xpathlabel="Name" xpath="Realizations/RSContext/Vector[@id='Canals']" type="vector" symbology="canals_ditches" />
        </Children>
      </Node>
      <Node label="Hydrology">
        <Children>
          <Node xpathlabel="Name" xpath="Realizations/RSContext/Vector[@id='NHDFlowline']" type="vector" symbology="flow_lines" />
          <Node label="Drainage Area (SqKm)" xpath="Realizations/RSContext/Vector[@id='NHDFlowline']" type="vector" symbology="UpstreamDrainageArea" />
          <Node xpathlabel="Name" xpath="Realizations/RSContext/Vector[@id='NHDPlusCatchment']" type="vector" symbology="" />
          <Node xpathlabel="Name" xpath="Realizations/RSContext/Vector[@id='NHDArea']" type="vector" symbology="" />
          <Node xpathlabel="Name" xpath="Realizations/RSContext/Vector[@id='NHDWaterbody']" type="vector" symbology="" />
          <Node xpathlabel="Name" xpath="Realizations/RSContext/Vector[@id='WBDHU2']" type="vector" symbology="" />
          <Node xpathlabel="Name" xpath="Realizations/RSContext/Vector[@id='WBDHU4']" type="vector" symbology="" />
          <Node xpathlabel="Name" xpath="Realizations/RSContext/Vector[@id='WBDHU6']" type="vector" symbology="" />
          <Node xpathlabel="Name" xpath="Realizations/RSContext/Vector[@id='WBDHU8']" type="vector" symbology="" />
          <Node xpathlabel="Name" xpath="Realizations/RSContext/Vector[@id='WBDHU10']" type="vector" symbology="" />
          <Node xpathlabel="Name" xpath="Realizations/RSContext/Vector[@id='WBDHU12']" type="vector" symbology="" />
        </Children>
      </Node>
      <Node label="Topography">
        <Children>
          <Node xpathlabel="Name" xpath="Realizations/RSContext/DEM" type="raster" symbology="dem" />
          <Node xpathlabel="Name" xpath="Realizations/RSContext/Raster[@id='HILLSHADE']" type="raster" symbology="" />
          <Node xpathlabel="Name" xpath="Realizations/RSContext/Raster[@id='SLOPE']" type="raster" symbology="" />
          <Node xpathlabel="Name" xpath="Realizations/RSContext/Raster[@id='FA']" type="raster" symbology="" />
          <Node xpathlabel="Name" xpath="Realizations/RSContext/Raster[@id='DA']" type="raster" symbology="" />
          <Node xpathlabel="Name" xpath="Realizations/RSContext/Raster[@id='HAND']" type="raster" symbology="" />
        </Children>
      </Node>
      <Node label="Ownership">
        <Children>
          <Node xpathlabel="Name" xpath="Realizations/RSContext/Vector[@id='Ownership']" type="vector" symbology="" />
        </Children>
      </Node>
      <Node label="Vegetation">
        <Children>
          <Node xpathlabel="Name" xpath="Realizations/RSContext/Raster[@id='EXVEG']" type="raster" symbology="" />
          <Node xpathlabel="Name" xpath="Realizations/RSContext/Raster[@id='HISTVEG']" type="raster" symbology="" />
        </Children>
      </Node>
    </Children>
  </Node>
</Project>