<?xml version="1.0" encoding="utf-8"?>
<Project xmlns:xsi="http://www.w3.org/2001/XMLSchema-instance" xsi:noNamespaceSchemaLocation="https://raw.githubusercontent.com/Riverscapes/RaveAddIn/master/RaveAddIn/XML/XSD/project_explorer.xsd">
  <Name>RVD</Name>
  <ProjectType>RVD</ProjectType>
  <Node xpathlabel="Name">
    <Children collapsed="false">
      <Node xpathlabel="Name" xpath="Realizations/RVD/Outputs/HTMLFile" type="file" />
      <Node label="Inputs" xpath="Realizations/RVD/Inputs">
        <Children>
          <Node xpathlabel="Name" xpath="Geopackage/Layers/Vector[@id='FLOWLINES']" type="vector" symbology="" />
          <Node xpathlabel="Name" xpath="Geopackage/Layers/Vector[@id='FLOW_AREA']" type="vector" symbology="" />
          <Node xpathlabel="Name" xpath="Geopackage/Layers/Vector[@id='WATERBODIES']" type="vector" symbology="" />
          <Node xpathlabel="Name" xpath="Geopackage/Layers/Vector[@id='VALLEY_BOTTOM']" type="vector" symbology="" />
          <Node xpathlabel="Name" xpath="Raster[@id='EXVEG']" type="raster" symbology="" />
          <Node xpathlabel="Name" xpath="Raster[@id='HISTVEG']" type="raster" symbology="" />
        </Children>
      </Node>
      <Node label="Intermediates" xpath="Realizations/RVD/Intermediates">
        <Children collapsed="true">
          <Node xpathlabel="Name" xpath="Geopackage/Layers/Vector[@id='CLEANED']" type="vector" symbology="" />
          <Node xpathlabel="Name" xpath="Geopackage/Layers/Vector[@id='NETWORK']" type="vector" symbology="" />
          <Node xpathlabel="Name" xpath="Geopackage/Layers/Vector[@id='THIESSEN']" type="vector" symbology="" />
        </Children>
      </Node>
      <Node label="Outputs" xpath="Realizations/RVD/Outputs">
        <Children>
          <Node xpathlabel="Name" xpath="Geopackage/Layers/Vector[@id='SEGMENTED']" type="vector" symbology="" />
        </Children>
      </Node>
    </Children>
  </Node>
</Project>