<?xml version="1.0" encoding="utf-8" ?>
<Project xmlns:xsi="http://www.w3.org/2001/XMLSchema-instance" xsi:noNamespaceSchemaLocation="XSD/project_explorer.xsd">
    <Name>RCA</Name>
    <ProjectType>RCA</ProjectType>
    <Node xpathlabel="Name">
        <Children>
            <Repeater label="Realizations" xpath="Realizations/RCA">
                <!-- this is a template for how realizations should render-->
                <Node xpathlabel="Name">
                    <Children collapsed="false">
                        <Node label="Inputs" xpath="Inputs">
                            <Children>
                                <Node xpathlabel="Name" xpath="ExistingVegetation" type="raster" symbology="">
                                    <Children>
                                        <Repeater label="Existing Cover Rasters" xpath="ExistingRasters">
                                            <Node xpathlabel="Name" xpath="Raster" type="raster" symbology="" />
                                        </Repeater>
                                    </Children>
                                </Node>
                                <Node xpathlabel="Name" xpath="HistoricVegetation" type="raster" symbology="">
                                    <Children>
                                        <Repeater label="Historic Cover Rasters" xpath="HistoricRasters">
                                            <Node xpathlabel="Name" xpath="Raster" type="raster" symbology="" />
                                        </Repeater>
                                    </Children>
                                </Node>
                                <Node xpathlabel="Name" xpath="DrainageNetworks/Network" type="vector" symbology="">
                                    <Children>
                                        <Node xpathlabel="Name" xpath="ThiessenPolygons" type="vector" symbology="" />
                                    </Children>
                                </Node>
                                <Node xpathlabel="Name" xpath="FragmentedValleyBottom" type="vector" symbology="" />
                                <Node xpathlabel="Name" xpath="LargeRiverPolygon" type="vector" symbology="" />
                            </Children>
                        </Node>
                        <Node label="Analyses" xpath="Analyses">
                            <Children>
                                <Node label="Outputs" xpath="Analysis/Outputs">
                                    <Children>
                                        <Node xpathlabel="Name" xpath="Vector" type="vector" symbology="vector_RCA" />
                                    </Children>
                                </Node>
                            </Children>
                        </Node>
                    </Children>
                </Node>
            </Repeater>
        </Children>
    </Node>
</Project>