<?xml version="1.0" encoding="utf-8"?>
<Project xmlns:xsi="http://www.w3.org/2001/XMLSchema-instance" xsi:noNamespaceSchemaLocation="https://raw.githubusercontent.com/Riverscapes/RaveAddIn/master/RaveAddIn/XML/XSD/project_explorer.xsd">
  <Name>GUT</Name>
  <ProjectType>GUT</ProjectType>
  <Node xpathlabel="Name">
    <Children>
      <Repeater label="Realizations" xpath="Realizations/GUT">
        <Node xpathlabel="Name">
          <Children collapsed="true">
            <Node label="Inputs" xpath="Inputs">
              <Children collapsed="true">
                <Node xpathlabel="Name" xpath="Centerline[@id='BFCL']" type="vector" symbology="in_BankfullCenterline" />
                <Node label="Bankfull Cross Sections QA/QC " xpath="CrossSections[@id='BFXS']" type="vector" symbology="XS_qaqc" />
				<Node label="Bankfull Cross Sections Type" xpath="CrossSections[@id='BFXS']" type="vector" symbology="XS_type" />
                <Node xpathlabel="Name" xpath="Extent[@id='BFEX']" type="vector" symbology="in_BankfullExtent" />
                <Node xpathlabel="Name" xpath="Islands[@id='BFI']" type="vector" symbology="bfIlsands" />
                <Node xpathlabel="Name" xpath="ChannelUnits[@id='CU']" type="vector" symbology="cu_UnitNum" />
                <Node xpathlabel="Name" xpath="ChannelUnits[@id='CU_1']" type="vector" symbology="Channel_Units_Field" transparency="40"/>
                <Node xpathlabel="Name" xpath="DEM" type="raster" symbology="dem" transparency="40" />
                <Node label="Thalweg Type" xpath="Thalweg" type="vector" symbology="in_Thalwegs_Type" />
				<Node label="Thalweg Channel" xpath="Thalweg" type="vector" symbology="in_Thalwegs_Channel"/>
                <Node xpathlabel="Name" xpath="Centerline[@id='WCL']" type="vector" symbology="in_WaterCenterline" />
                <Node label="Wetted Cross Sections QA/QC" xpath="CrossSections[@id='WXS']" type="vector" symbology="XS_qaqc" />
				<Node label="Wetted Cross Sections Type" xpath="CrossSections[@id='WXS']" type="vector" symbology="XS_type" />
                <Node xpathlabel="Name" xpath="Extent[@id='WEEX']" type="vector" symbology="in_WaterExtent" transparency="40" />
                <Node xpathlabel="Name" xpath="Islands[@id='WI']" type="vector" symbology="wetIslands" />
              </Children>
            </Node>
            <Node label="Evidence" xpath="EvidenceLayers">
              <Children collapsed="true">
                <Node xpathlabel="Name" xpath="Raster[@id='ID']" type="raster" symbology=""/>
                <Node xpathlabel="Name" xpath="Vector[@id='ID']" type="vector" symbology=""/>
                <Node xpathlabel="Name" xpath="Raster[@id='ID_1']" type="raster" symbology=""/>
                <Node xpathlabel="Name" xpath="Slope[@id='BFSLOPE']" type="raster" symbology=""/>
                <Node xpathlabel="Name" xpath="Raster[@id='ID_2']" type="raster" symbology=""/>
                <Node xpathlabel="Name" xpath="Raster[@id='ID_3']" type="raster" symbology=""/>
                <Node xpathlabel="Name" xpath="Slope[@id='BFSSSMOOTH']" type="raster" symbology=""/>
                <Node xpathlabel="Name" xpath="Vector[@id='ID_1']" type="vector" symbology=""/>
                <Node xpathlabel="Name" xpath="Vector[@id='ID_2']" type="vector" symbology=""/>
                <Node xpathlabel="Name" xpath="Vector[@id='ID_3']" type="vector" symbology=""/>
                <Node xpathlabel="Name" xpath="Vector[@id='ID_4']" type="vector" symbology=""/>
                <Node xpathlabel="Name" xpath="Vector[@id='ID_5']" type="vector" symbology=""/>
                <Node xpathlabel="Name" xpath="DEM[@id='DEMSMOOTH']" type="raster" symbology=""/>
                <Node xpathlabel="Name" xpath="Raster[@id='ID_5']" type="raster" symbology=""/>
                <Node xpathlabel="Name" xpath="Raster[@id='ID_6']" type="raster" symbology=""/>
                <Node xpathlabel="Name" xpath="Raster[@id='ID_7']" type="raster" symbology=""/>
                <Node xpathlabel="Name" xpath="Raster[@id='ID_8']" type="raster" symbology=""/>
                <Node xpathlabel="Name" xpath="Raster[@id='ID_9']" type="raster" symbology=""/>
                <Node xpathlabel="Name" xpath="Slope[@id='ICDEMSLOPE']" type="raster" symbology=""/>
                <Node xpathlabel="Name" xpath="Vector[@id='ID_7']" type="vector" symbology=""/>
                <Node xpathlabel="Name" xpath="Vector[@id='ID_8']" type="vector" symbology=""/>
                <Node xpathlabel="Name" xpath="Vector[@id='ID_9']" type="vector" symbology=""/>
                <Node xpathlabel="Name" xpath="Vector[@id='ID_10']" type="vector" symbology=""/>
              </Children>
            </Node>
            <Repeater label="Analyses" xpath="Analyses/Analysis">
              <Node xpathlabel="Name">
                <Children collapsed="true">
                  <Node xpathlabel="Name" xpath="Outputs/Tier1" type="vector" symbology=""/>
                  <Node xpathlabel="Name" xpath="Outputs/Tier2[@id='Tier2']" type="vector" symbology=""/>
                  <Node xpathlabel="Name" xpath="Outputs/Tier2[@id='Tier2_1']" type="vector" symbology=""/>
                  <Node xpathlabel="Name" xpath="Outputs/Tier3[@id='Tier3']" type="vector" symbology=""/>
                  <Node xpathlabel="Name" xpath="Outputs/Tier3[@id='Tier3_1']" type="vector" symbology=""/>
                  <Node xpathlabel="Name" xpath="Outputs/Tier3[@id='Tier3_2']" type="vector" symbology=""/>
                  <Node xpathlabel="Name" xpath="Outputs/Tier1[@id='Tier3_3']" type="vector" symbology=""/>
                </Children>
              </Node>
            </Repeater>
          </Children>
        </Node>
      </Repeater>
    </Children>
  </Node>
</Project>
