<?xml version="1.0" encoding="utf-8" ?>
<Project xmlns:xsi="http://www.w3.org/2001/XMLSchema-instance" xsi:noNamespaceSchemaLocation="https://raw.githubusercontent.com/Riverscapes/RaveAddIn/master/RaveAddIn/XML/XSD/project_explorer.xsd">
  <Name>pyBRAT</Name>
  <ProjectType>pyBRAT</ProjectType>
  <Node xpathlabel="Name">
    <Children collapsed="false">
      <Node label="Outputs" xpath="Realizations/BRAT/Outputs">
        <Children>
          <Node label="Validation">
            <Children>
              <Node label="Surveyed Beaver Dam Locations"/>
              <Node label="Predicted Dam Density vs. Surveyed Dam Density"/>
              <Node label="Percent of Historic Dam Capacity Remaining"/>
							<Node label="Current Beaver Dam Management Strategies"/>
            </Children>
          </Node>
					<Node label="Capacity">
						<Children>
							<Node label="Existing Capacity">
								<Children>
									<Node label="Existing Dam Capacity"/>
									<Node label="Existing Dam Size"/>
								</Children>
							</Node>
							<Node label="Historic Capacity">
								<Children>
									<Node label="Historic Dam Capacity"/>
									<Node label="Historic Dam Size"/>
								</Children>
							</Node>
						</Children>
					</Node>
					<Node label="Management">
						<Children>
							<Node label="Unsuitable or Limited Opportunities"/>
							<Node label="Risk of Undesirable Dams"/>
							<Node label="Restoration or Conservation Opportunities"/>
						</Children>
					</Node>
        </Children>
      </Node>
      <Node label="Intermediates" xpath="Realizations/BRAT/Outputs">
        <Children>
          <Node label="Perennial"/>
					<Node label="Anabranch Handler"/>
          <Node label="Topographic Index">
            <Children>
              <Node label="Slope"/>
              <Node label="Drainage Area"/>
            </Children>
          </Node>
          <Node label="Hydrology">
            <Children>
              <Node label="High Flow Stream Power"/>
              <Node label="Base Flow Stream Power"/>
            </Children>
          </Node>
          <Node label="Overall Vegetation Dam Capacity">
            <Children>
              <Node label="Existing Veg Dam Building Capacity"/>
              <Node label="Historic Veg Dam Building Capacity"/>
            </Children>
          </Node>
          <Node label="Anthropogenic Intermediates">
            <Children>
              <Node label="Distance to Canals/Ditches"/>
							<Node label="Distance to Closest Infrastructure"/>
							<Node label="Distance to Points of Diversion"/>
							<Node label="Distance to Railroad"/>
							<Node label="Distance to Railroad in Valley Bottom"/>
							<Node label="Distance to Road"/>
              <Node label="Distance to Road Crossing"/>
              <Node label="Distance to Road in Valley Bottom"/>
							<Node label="Land Ownership per Reach"/>
              <Node label="Land Use Intensity"/>
							<Node label="Priority Beaver Translocation Areas"/>
            </Children>
          </Node>
          <Node label="Buffers">
            <Children>
              <Node label="30m Buffer"/>
              <Node label="100m Buffer"/>
            </Children>
          </Node>		  
        </Children>
      </Node>
      <Node label="Inputs" xpath="Realizations/BRAT/Inputs">
        <Children>
					<Node label="Anthropogenic Layers">
            <Children>
							<Node label="Canals">
								<Children>
									<Node label="Provisional Points of Diversion"/>
									<Node label="Canals and Ditches"/>
								</Children>
							</Node>
							<Node label="Valley Bottom">
								<Children>
									<Node label="Valley Bottom Outline"/>
									<Node label="Valley Bottom Fill"/>
								</Children>
							</Node>
              <Node label="Railroads"/>
              <Node label="Roads"/>
              <Node label="Land Ownership"/>
              <Node label="Land Use"/>
            </Children>
          </Node>
					<Node label="Vegetation">
            <Children>
							<Node label = "Existing Vegetation Dam Capacity">
								<Children>
									<Node label="Veg Type - EVT Type"/>
									<Node label="Veg Type - EVT Name"/>
									<Node label="Veg Type - EVT Class"/>
									<Node label="Existing Vegetation Suitability for Beaver Dam Building"/>
									<Node label="Existing Riparian"/>
								</Children>
							</Node>
							<Node label = "Historic Vegetation Dam Capacity">
								<Children>
									<Node label="Veg Type - BPS Type"/>
									<Node label="Veg Type - BPS Name"/>
									<Node label="Historic Vegetation Suitability for Beaver Dam Building"/>
									<Node label="Historic Riparian"/>
								</Children>
							</Node>							
            </Children>
          </Node>
          <Node label="Topography">
            <Children>
              <Node label="Flow Accumulation"/>
              <Node label="Slope"/>
              <Node label="DEM"/>
              <Node label="Hillshade"/>
            </Children>
          </Node>
        </Children>
      </Node>
    </Children>
  </Node>
</Project>